{
  "id": "doc-clean-001",
  "fileName": "invoice-clean-001.pdf",
  "uploadedAt": "2026-10-12T09:00:00.000Z",
  "supplierName": "Alpha Supplies",
  "language": "en",
  "type": "invoice",
  "status": "auto_approved",
  "extracted": {
    "invoiceNumber": "INV-1001",
    "date": "2026-09-30",
    "currency": "USD",
    "poNumber": "PO-2001",
    "lines": [
      { "description": "Screwdriver", "qty": 20, "unitPrice": 5.0, "lineTotal": 100.0 },
      { "description": "Hammer", "qty": 10, "unitPrice": 12.0, "lineTotal": 120.0 }
    ],
    "subtotal": 220.0,
    "tax": 22.0,
    "total": 242.0,
    "bankAccount": "111222333"
  },
  "confidence": {
    "invoiceNumber": 0.99,
    "date": 0.98,
    "currency": 0.97,
    "poNumber": 0.96,
    "total": 0.99,
    "bankAccount": 0.95
  },
  "issues": [],
  "explanation": "All fields match the purchase order and confidence thresholds are met.",
  "supplierReplyDraft": "Dear Alpha Supplies,\n\nWe have successfully processed your invoice INV-1001. Thank you for your prompt delivery.\n\nBest regards,\nPurchasing Team",
  "redactedFileUrl": "https://example.com/redacted/inv-1001.pdf",
  "timing": { "totalMs": 1200, "modelMs": 350 },
  "costEstimate": 0.010
}
